"","link","page","ad_url","ad_number","title","price","text","n_photos","n_views","ad_date","seller_name","location","seller_age","n_all_time_ads","n_active_ads","scrape_time","province"
"1","https://www.gumtree.co.za/s-mountain-bikes/v1c9800p1page-1/v1c9800p1",1,"https://www.gumtree.co.za/a-mountain-bikes/centurion/merida-big-nine-xt-edi/10011932119801010453118109",1,"Merida Big Nine XT Edi",15000,"Our aluminium BIG.NINE XT-EDITION hardtail that just drips with Shimano’s XT components. But the XT is more than just a high-quality drivetrain and powerful brakes. To finish the picture and make our XT-EDITION one of the most desirable bikes in our aluminium hardtail line-up, we spec our double butted aluminium frame with a Manitou Markhor fork and tubeless ready wheelset.Mountain biking is one of the most varied cycling disciplines and probably the most demanding when it comes to equipment. While full suspension bikes offer amazing riding characteristics, the classic hardtail remains one of the purest tools for the job. Our 29er wheel equipped BIG.NINE range comes in carbon and aluminium and features multiple geometry options. The carbon and LITE framed BIG.NINE, with its racing geometry, is an ideal companion on XC and marathon race tracks whilst the more relaxed geometry of the BIG.NINE TFS and SPEED offers a more comfortable, upright riding position. Our classic hardtails are the backbone of our range and showcase the enormous wealth of experience and knowledge we could gain in almost half a century of bike production and manufacturing. The BIG.NINE range symbolises the symbiosis between modern frame technology, attention to detail and craftsmanship ‘Made in Taiwan’.Double butted smooth welded aluminium frame with 29er wheelsLess aggressive and more upright geometry for maximum control and comfortManitou Markhor 100 mm travel suspension fork with remote lockoutShimano XT 12-speed drivetrain and Shimano XT disc brakesTubeless ready wheelset and fast Maxxis tyresInternal cable routingDescription Frame Big.nine Tfs IiiFrame Size: XLColor Dark Silver (Black)Fork Manitou Markhor CompBrakes Shimano XT Rotors Shimano Rt54Headset Merida M2331Handlebar Merida Expert CcHandlebar Stem Merida Expert CcGrip Merida Comp EcDerailleur (R) Shimano Xt M8100 Shadow+Shifters Shimano XTSeat Post Merida Comp CcSeat Clamp Merida Comp QrSaddle Merida Comp SlPedal Vp Vpe-891Chain Kmc X12Crank Shimano XtFreewheel Shimano Deore M6100Bottom Bracket Shimano Bb52 BsaHubs Shimano Mt400-b / Shimano Mt401Rim Merida Expert CcTyre Front Maxxis IkonTyre Rear Maxxis IkonSpokes Double Butted Black StainlessMax Weight 135 Kg",12,24,"2023-03-07 14:11:46","Nacinda Nunes","Centurion, Pretoria / Tshwane, Gauteng",NA,NA,NA,"2023-03-08 12:11:46","Gauteng"
"2","https://www.gumtree.co.za/s-mountain-bikes/v1c9800p1page-1/v1c9800p1",1,"https://www.gumtree.co.za/a-mountain-bikes/durbanville/trek-stache-9-7/10011934833481013039371709",2,"Trek Stache 9.7",35450,"Trek Stache 9.7Full Carbon size largeSRAM GX 1x12 groupsetSRAM Guide hydraulic brakesRockshox Pike 120mm front shockDropper PostBontrager WheelsetContact Number 0721325576",7,2,"2023-03-08 12:06:47","sean","Durbanville, Northern Suburbs, Western Cape",NA,NA,NA,"2023-03-08 12:11:47","Western Cape"
"3","https://www.gumtree.co.za/s-mountain-bikes/v1c9800p1page-1/v1c9800p1",1,"https://www.gumtree.co.za/a-mountain-bikes/durbanville/silverback-sprada-1/10011934796501013039371709",3,"Silverback Sprada 1",22850,"Silverback Sprada 1Alloy dual suspension size mediumShimano 3x10 XT and SLX componentsRockshox SID front suspensionFOX Float rear suspensionSlick tyres and tubeles MTB tyresContact Number 0721325576",7,5,"2023-03-08 11:57:47","sean","Durbanville, Northern Suburbs, Western Cape",NA,NA,NA,"2023-03-08 12:11:47","Western Cape"
"4","https://www.gumtree.co.za/s-mountain-bikes/v1c9800p1page-1/v1c9800p1",1,"https://www.gumtree.co.za/a-mountain-bikes/paarl/29er-gt-avalanche-comp-m-frame-has-air-shock-9x2-gears/10011934667661010259023609",4,"29er gt avalanche comp m frame has air shock 9x2 gears",7500,"Excellent condition 29er gt avalanche comp medium frame has air shock 9x2 gears hydrualic brakes remote lock out tubeless ready tires recent service call or whatsapp 0842892272 pick up in paarl can courier any where in sa",7,5,"2023-03-08 11:26:48","Gumtree ZA user","Paarl, Cape Winelands, Western Cape",NA,NA,NA,"2023-03-08 12:11:48","Western Cape"
"5","https://www.gumtree.co.za/s-mountain-bikes/v1c9800p1page-1/v1c9800p1",1,"https://www.gumtree.co.za/a-mountain-bikes/paarl/brand-new-29er-nerida-big-nine-20-xxl-frame/10011934657591010259023609",5,"Brand new 29er nerida big nine 20 xxl frame",6000,"Brand new 29er merida big nine 20 xxl frame had hydrualic brakes 8x3 gears internal cabling save thousands on shop price call or whatsapp 0842892272 pick up in paarl can courier any where in sa",8,4,"2023-03-08 11:23:49","Gumtree ZA user","Paarl, Cape Winelands, Western Cape",NA,NA,NA,"2023-03-08 12:11:49","Western Cape"
"6","https://www.gumtree.co.za/s-mountain-bikes/v1c9800p1page-1/v1c9800p1",1,"https://www.gumtree.co.za/a-mountain-bikes/paarl/29er-merida-big-nine-40-medium-frame/10011934649841010259023609",6,"29er merida big nine 40 medium frame",5700,"Good condition 29er merida big nine 40  medium frame has hydrualic brakes 9x3 gears front lock out shock recent service call or whatsapp 0842892272 pick up in paarl can courier any where in sa",7,5,"2023-03-08 11:21:49","Gumtree ZA user","Paarl, Cape Winelands, Western Cape",NA,NA,NA,"2023-03-08 12:11:49","Western Cape"
"7","https://www.gumtree.co.za/s-mountain-bikes/v1c9800p1page-1/v1c9800p1",1,"https://www.gumtree.co.za/a-mountain-bikes/kuils-river/29er-cannondale-scalpel-duel-suspension-mtb-+-lefty-fork-+-tubeless-+-2-x-10-drivetrain/10011894420771010003575409",7,"29ER CANNONDALE SCALPEL DUEL SUSPENSION MTB - LEFTY FORK - TUBELESS - 2 X 10 DRIVETRAIN",18500,"29ER CANNONDALE SCALPEL DUEL SUSPENSION MOUNTAINBIKE WITH LEFTY FORK! VERY GOOD CONDITION ALL AROUND, MECHANICALLY IN AN EXCELLENT CONDITION. LEFTY FORK IS SMOOTH AND LOCKS OUT PERFECTLY. **LEFTY AIR FORK, FOX FLOAT REAR****TUBELESS CONVERSION DONE****2 X 10 SRAM DRIVETRAIN****LARGE FRAME // 29ER WHEELS**LARGE CANNONDALE SCALPEL ALLOY FRAMECANNONDALE LEFTY 100 WITH POPTOP AND REBOUNDFOX FLOAT REAR AIR SHOCK WITH LOCKOUT WTB DOUBLE WALL RIMSMAXXIS AND SCHWALBE TUBELESS TYRESUPGRADED SHIMANO DEORE HYDRAULIC DISK BRAKESSRAM X9 REAR DERAILLEUR 10SPDSRAM CRANKSRAM X7 FRONT DERAILLEUR SRAM X7 SHIFTERSCANNONDALE HANDLEBAR AND STEMCANNONDALE SEATPOSTFIZIK SEATSHIMANO SPD PEDALSSYNCROS FOAM GRIPSBIKE IS CHECKED, WASHED, LUBED AND READY TO RACE!VIEWING AND TESTING WELCOME!PRICE: R18500FOR MORE INFOLIZELLE: 0826038599Not what you are looking for?Check out our page on Facebook.https://www.facebook.com/cycleshifdSITUATED IN KUILSRIVIER.COURIER AVAILABLE ALL OVER SOUTH AFRICA!VIEWING BY APPOINTMENT ONLY.Items Available: 1",19,285,"2023-02-22 12:11:49","LizelleVDM","Kuils River, Northern Suburbs, Western Cape",NA,NA,NA,"2023-03-08 12:11:50","Western Cape"
"8","https://www.gumtree.co.za/s-mountain-bikes/v1c9800p1page-1/v1c9800p1",1,"https://www.gumtree.co.za/a-mountain-bikes/tokai/2021-scott-spark-960-mtb-bike/10010811681371011247410409",8,"2021 SCOTT SPARK 960 MTB BIKE",44900,"2021 SCOTT SPARK 960 SMALL ONLY AVAILABLESPECIFICATIONSFrameSpark 3 Alloy SL 6011 Custom Butted Hydroformed Tubes Tapered Headtube / BB92 / Boost 12x148mm 2.6"" tire compatibleForkRockShox Judy Silver TK Solo Air 15x110mm QR axle / 42mm offset / Tapered Steerer 2-Modes / Reb. Adj. / Lockout / 130mm travelRear ShockX-Fusion NUDE RLX Trunnion SCOTT custom w. travel / geo adj. 3 modes: Lockout-Traction Control -Descend Reb. Adj. Travel 120-85-Lockout / 165X45mmRemote SystemSCOTT TwinLoc TSP Suspension-Seatpost Remote below Bar / integ. Grip clampRear DerailleurShimano XT RD-M8100 SGS Shadow Plus / 12 SpeedShiftersShimano Deore SL-M6100-IR / Rapidfire Plus Ispec EV clampCranksetShimano FC-MT511-1 32TChainguideSCOTT customBB-SetShimano BB-MT500 / shell 41x92mmChainKMC X12CassetteShimano Deore CS-M6100-12 / 10-51 TBrakesShimano MT201 DiscRotorShimano SM-RT10 CL / F&R 180mmHandlebarSyncros Alloy 6061 T shape Flat / 9° / 760mm Syncros Pro lock-on gripsH'stemSyncros Alloy 6061 oversized 31.8mm / 1 1/8"" / 6° angleSeatpostSyncros Duncan Dropper Post 2.5 31.6mm / S size 100mm / M, L & XL 125mmSeatSyncros Belcarra Regular 2.5HeadsetSyncros OE Press Fit / Tapered 1.5""-1 1/8"" OD 50/61mm / ID 44/55mmHub (Front)Shimano HB-MT410-B CL / 15x110mmHub (Rear)Shimano FH-MT410-B CL / Boost 12x148mm / Micro SplineSpokesStainless Black 15G / 1.8mmRimsSyncros X-25 / 32H / 25mmFront TireMaxxis Rekon / 2.4"" / 60TPIRear TireMaxxis Rekon / 2.4"" / 60TPIApprox weights in KG14.50Approx weights in LBS31.97Max. System Weight128 kg The overall weight includes the bike the rider the equipment and possible additional luggage.CALL OR WHATSAPP08323109740217150732Items Available: 1",1,2041,"2022-05-08 03:11:50","Bridge Cycles CC","Tokai, Southern Suburbs, Western Cape",NA,NA,NA,"2023-03-08 12:11:50","Western Cape"
"9","https://www.gumtree.co.za/s-mountain-bikes/v1c9800p1page-1/v1c9800p1",1,"https://www.gumtree.co.za/a-mountain-bikes/kuils-river/29er-cannondale-rush-duel-suspension-mtb-+-tubeless-+-rock-shox-air-+-stunning-cond/10011894281401010003575409",9,"29ER CANNONDALE RUSH DUEL SUSPENSION MTB - TUBELESS - ROCK SHOX AIR - STUNNING COND",19500,"29ER CANNONDALE RUSH DUEL SUSPENSION MOUNTAINBIKE.STUNNING CONDITION ALL AROUND, BIKE DID 400KM IN TOTAL! SERVICED AND READY TO HIT THE TRAILS!**TUBELESS CONVERSION DONE****ROCK SHOX AIR SUSPENSION****SLX 10 SPEED****LARGE FRAME // 29ER WHEELS**LARGE CANNONDALE RUSH ALLOY FRAMEROCK SHOX 30 100MM AIR FORK WITH REMOTE LOCKOUTROCK SHOX MONARCH REAR AIR SHOCK WITH LOCKOUTNEW MAXXIS ARDENT RACE AND IKON TUBELESS TYRESALEXRIMS DOUBLE WALL RIMSSHIMANO SLX REAR DERAILLEUR 10 SPDSHIMANO DEORE RAPIDFIRE SHIFTERSSHIMANO DEORE FRONT DERAILLEUR SHIMANO CRANKCANNONDALE SEAT AND SEATPOSTCANNONDALE HANDLEBAR AND STEMRYDER PEDALSPUMP WITH PUMPHOLDERBOTTLEHOLDER STUNNING CONDITION!VIEWING AND TESTING WELCOME!BIKE IS RACE READY // GET ON AND GO!PRICE: R19500FOR MORE INFOLIZELLE: 0826038599Items Available: 1",17,257,"2023-02-22 12:11:51","LizelleVDM","Kuils River, Northern Suburbs, Western Cape",NA,NA,NA,"2023-03-08 12:11:51","Western Cape"
"10","https://www.gumtree.co.za/s-mountain-bikes/v1c9800p1page-1/v1c9800p1",1,"https://www.gumtree.co.za/a-mountain-bikes/tokai/avalanche-zoid-16-girls-bikes/10010809664811011247410409",10,"AVALANCHE ZOID 16 GIRLS BIKES",1795,"AVALANCHE 16"" GIRLS KIDSVARIOUS COLOURSItems Available: 1",2,1140,"2022-04-07 16:41:51","Bridge Cycles CC","Tokai, Southern Suburbs, Western Cape",NA,NA,NA,"2023-03-08 12:11:51","Western Cape"
"11","https://www.gumtree.co.za/s-mountain-bikes/v1c9800p1page-1/v1c9800p1",1,"https://www.gumtree.co.za/a-mountain-bikes/tokai/2021-scott-spark-940-mtb-bikes/10010811520441011247410409",11,"2021 SCOTT SPARK 940 MTB BIKES",59000,"2021 Scott Spark 940 BikeSpecificationsProduct	Scott Spark 940 BikeModel Year	2021Riding Type	TrailRider	UnisexSizes  SM, MD, LG,  Wheel Size	29""Frame Material	Carbon FiberFrame Material Details	HMF carbon main frame, IMP (Integrated Molding Process) Technology; 6011 SL alloy rear triangle; molded chainstay protectionRear Travel	120mmRear Shock	FOX FLOAT DPS Performance, EVOL, 3-mode adjust via Scott TwinLoc TSP (Lockout, Trail, Descend), rebound adjust, trunnion mount, 165mm x 45mmFork	RockShox Revelation RL3, Charger damper, 3-mode adjust via Scott TwinLoc TSP (Lockout, Trail, Descend), rebound adjust, 42mm offsetFork Travel	130mmHead Tube Diameter	Tapered, 1.125"" top, 1.5"" bottomHeadset	Syncros Pro Drop-inHandlebar	Syncros Fraser 2.0, 6061 alloy, 9° sweep, 760mm width, 31.8mm clamp diameterStem	Syncros FL2.0, 6061 alloy, 6° rise, 31.8mm bar clampLength: 50mm (SM), 60mm (MD), 70mm (LG), 80mm (XL)Grips	Syncros Pro, lock-onBrakes	Shimano MT501, 2-piston, Shimano RT54 CENTER LOCK 180mm rotorsBrake Levers	Shimano MT501Drivetrain	1xShifters	SRAM SX Eagle, 12-speed, TriggerFront Derailleur	NoneRear Derailleur	SRAM NX Eagle, 12-speedISCG Tabs	NoneChainguide	Scott upper sliderCranks	SRAM X1 Eagle DUBChainrings	SRAM X1 Eagle, 32 toothBottom Bracket	SRAM DUB, 92mm PressFitPedals	NoneChain	SRAM NX Eagle, 12-speedCassette	SRAM SX Eagle PG-1210, 12-speed, 11-50 toothRims	Syncros X-25, 25mm width, 32 hole, tubeless readyHubs	Front: Formula CL-811, 32 hole, CENTER LOCK rotor mount, 110x15mm BoostRear: Formula CL-148S, 32 hole, CENTER LOCK rotor mount, 148x12mm Boost, HG driverSpokes	Stainless steel 15g/1.8mmTires	Maxxis Rekon, EXO, TR, 60 TPI, Kevlar bead, 29"" x 2.4""Saddle	Syncros Belcarra Regular 2.5Seatpost	Syncros Duncan 2.5 dropperDrop: 100mm (SM), 125mm (MD/LG/XL)Seatpost Diameter	31.6mmSeatpost Clamp	Single boltRear Dropout / Hub Dimensions	148x12mm BoostMax. Tire Size	29"" x 2.6""Bottle Cage Mounts	One inside front triangleColors	BlackWarranty	5 years frameWeight	29 lb 8.7 oz (13,400 g)Miscellaneous	Scott TwinLoc TSP system provides three suspension modes (Lockout, Trail, Descend) for shock and fork via handlebar-mounted remoteInternal cable routingPrice	R65000CALL OR WHATSAPP08323109740217150974Items Available: 1",1,2022,"2022-05-08 03:11:52","Bridge Cycles CC","Tokai, Southern Suburbs, Western Cape",NA,NA,NA,"2023-03-08 12:11:52","Western Cape"
"12","https://www.gumtree.co.za/s-mountain-bikes/v1c9800p1page-1/v1c9800p1",1,"https://www.gumtree.co.za/a-mountain-bikes/muizenberg/gt-26er-mountain-bike/10011934387951011005542409",12,"GT 26er Mountain bike",3900,"-Excellent Condition
-Size Large Frame
-Aluminium Tubing
-Serviced
-Tektro Hydraulic Brakes
-Shimano 3x9 Gearing
-Rockshox Fork
-New Tyres
-New Handlebar Grips
-Alloy FlatGrip Pedals

R3900 Negotiable

0718682829",4,6,"2023-03-08 11:11:53","Rifat Adams","Muizenberg, Southern Peninsula, Western Cape",NA,NA,NA,"2023-03-08 12:11:53","Western Cape"
"13","https://www.gumtree.co.za/s-mountain-bikes/v1c9800p1page-1/v1c9800p1",1,"https://www.gumtree.co.za/a-mountain-bikes/centurion/silverback-sola/10011934357671012605405209",13,"Silverback Sola",8500,"See picture attached with Specs.",12,10,"2023-03-08 11:11:53","Niel Olivier","Centurion, Pretoria / Tshwane, Gauteng",NA,NA,NA,"2023-03-08 12:11:53","Gauteng"
"14","https://www.gumtree.co.za/s-mountain-bikes/v1c9800p1page-1/v1c9800p1",1,"https://www.gumtree.co.za/a-mountain-bikes/sunningdale/raleigh-16inch-atom-girls-mountain-bike-for-sale/10011934344671010425414209",14,"Raleigh 16inch Atom Girls Mountain Bike for sale",600,"Raleigh 16inch Atom Girls Mountain Bike for sale | R600",3,5,"2023-03-08 11:11:53","Sarah Bakos","Sunningdale, West Coast, Western Cape",NA,NA,NA,"2023-03-08 12:11:54","Western Cape"
"15","https://www.gumtree.co.za/s-mountain-bikes/v1c9800p1page-1/v1c9800p1",1,"https://www.gumtree.co.za/a-mountain-bikes/mbombela-nelspruit/apex-a900+pro-men-s-29-alloy-mountain-bike/10011321508351012743780109",15,"APEX A900-PRO MEN’S 29? ALLOY MOUNTAIN BIKE",13195,"The Apex A900-PRO Men’s 29? Mountain Bike is super lightweight with alloy frame and 29? double wall rims offering a great riding experience!Rim: Alloy Double Wall, 29?-32 Hole F/VTyres: CST – Camber 29.2.25 – 27TPIBrakes: Disc – Mechanical With Dual Piston 160 RotatorCranks: Pro-wheel – Zephyr – 34T/10SPDCassette: LTW00-CS-M6010 11-46T-10SPDFront Derailleur: N/AFrame: Lightweight Alloy Frame With Internal Cable Routing for Improved RoutingSaddle: APEX RACEShifters: LTW000-A7-SL-V5010Rear Derailleur: LTW000-A7-RD-V5010-10SPDFork: HL-VAXA-860S-AMS|29? 100mm|HL/O With LockoutItems Available: 1Stock ID: SKU: 24145Contact details: 063 855 5590 (Calls and Whatsapp messages welcome)",2,670,"2022-09-06 21:11:54","BOATSSA Nelspruit","Mbombela / Nelspruit, Mpumalanga, Mpumalanga",NA,NA,NA,"2023-03-08 12:11:54","Mpumalanga, Mpumalanga"
"16","https://www.gumtree.co.za/s-mountain-bikes/v1c9800p1page-1/v1c9800p1",1,"https://www.gumtree.co.za/a-mountain-bikes/kuils-river/kontant-vir-jou-fiets/1008223744960910003575409",16,"KONTANT VIR JOU FIETS",18000,"Pop me a whatsapp or give me a call. Instant cash paid for your bike. Cash paid for your bicycle.It MUST have HYDRAULIC DISC BRAKES. MUST BE IN AN EXCELLENT CONDITION. 26 inch, 27.5 inch or 29 inch wheels.Send me a picture of your bicycle and we can chat on whattsapp 0826038599 I will not waste your time with silly offers.Will beat any confirmed offer. 0826038599 Giant Merida mountainbike Specialized Cannondale Scott Titan Dual Suspension Hardtail Softail Trek Silverback Kona Santa Cruz Momsen Banshee YT Yeti Pyga Devinci Charge Focus Ellsworth Ghost GT Ibis KTM Niner NS Nukeproof Orbea PivotItems Available: 1",1,4552,"2021-03-08 00:11:55","LizelleVDM","Kuils River, Northern Suburbs, Western Cape",NA,NA,NA,"2023-03-08 12:11:55","Western Cape"
"17","https://www.gumtree.co.za/s-mountain-bikes/v1c9800p1page-1/v1c9800p1",1,"https://www.gumtree.co.za/a-mountain-bikes/queensburgh/specialized-start-jumper-mtb/10011933760071010048321509",17,"Specialized Start Jumper MTB",7900,"Specialized Start Jumper Mountain in good condition .
Needs a little tlc maybe a new seat.

R7900 onco",4,8,"2023-03-08 09:11:55","Mason","Queensburgh, West Suburbs, KwaZulu-Natal",NA,NA,NA,"2023-03-08 12:11:55","KwaZulu-Natal"
"18","https://www.gumtree.co.za/s-mountain-bikes/v1c9800p1page-1/v1c9800p1",1,"https://www.gumtree.co.za/a-mountain-bikes/kuils-river/mountain-bikes/10011933707171010836779009",18,"Mountain bikes",1750,"I am selling 3 mountain bikes..got small defects..R1750 for all..",3,20,"2023-03-08 09:11:56","Alton Levendal","Kuils River, Northern Suburbs, Western Cape",NA,NA,NA,"2023-03-08 12:11:56","Western Cape"
"19","https://www.gumtree.co.za/s-mountain-bikes/v1c9800p1page-1/v1c9800p1",1,"https://www.gumtree.co.za/a-mountain-bikes/knysna/peugeot-altitude-mtb-for-sale/10011757208731010022473109",19,"Peugeot Altitude MTB for sale",1250,"Peugeot Altitude 26inch MTB. 18 speed Shimano. Frame size L",1,305,"2023-02-06 01:41:56","Eugene Swanepoel","Knysna, Eden, Western Cape",NA,NA,NA,"2023-03-08 12:11:56","Western Cape"
"20","https://www.gumtree.co.za/s-mountain-bikes/v1c9800p1page-1/v1c9800p1",1,"https://www.gumtree.co.za/a-mountain-bikes/tokai/2022-scott-aspect-960-29er-mtb/10010239636641011247410409",20,"2022 SCOTT ASPECT 960 29ER MTB",2500,"2022 Scott Aspect 960 Features:Aspect 700/900 Alloy FrameSuntour XCE28 100mmShimano TX800 16 SpeedTektro Hyd. Disc BrakesKenda BoosterItems Available: 4",1,2876,"2022-03-08 06:11:57","Bridge Cycles CC","Tokai, Southern Suburbs, Western Cape",NA,NA,NA,"2023-03-08 12:11:57","Western Cape"
"21","https://www.gumtree.co.za/s-mountain-bikes/v1c9800p1page-1/v1c9800p1",1,"https://www.gumtree.co.za/a-mountain-bikes/brackenfell/giant-atx-retro-downhill-bike/10011933422941012610025309",21,"Giant Atx retro downhill bike",4800,"Giant Atx retro downhill bikeBike can do with a service Collect in Brackenfell ",1,9,"2023-03-08 08:11:57","loren martin","Brackenfell, Northern Suburbs, Western Cape",NA,NA,NA,"2023-03-08 12:11:57","Western Cape"
"22","https://www.gumtree.co.za/s-mountain-bikes/v1c9800p1page-2/v1c9800p2",2,"https://www.gumtree.co.za/a-mountain-bikes/brackenfell/bulls-xc-black-adder-mountain-bike/10011933429141012610025309",22,"Bulls XC black adder mountain bike",6800,"Bulls XC black adder mountain bikeBike is in excellent condition*Large Carbon frame*26er wheelset*27 speed *SLX components*Hydraulic brakes*Rear brake needs to be bleed*Comes with another set of pedals and not the red setCollection in Brackenfell",6,7,"2023-03-08 07:11:58","loren martin","Brackenfell, Northern Suburbs, Western Cape",NA,NA,NA,"2023-03-08 12:11:58","Western Cape"
"23","https://www.gumtree.co.za/s-mountain-bikes/v1c9800p1page-2/v1c9800p2",2,"https://www.gumtree.co.za/a-mountain-bikes/kuils-river/cash-for-your-mountainbike/1007707981430910003575409",23,"CASH FOR YOUR MOUNTAINBIKE",18000,"I PAY CASH FOR YOUR UNWANTED MOUNTAINBIKE !ANYWHERE IN THE WESTERN CAPE. I WILL COME TO YOU !No need to advertise and have countless people wasting your time with silly offers!!!NO SCAMMING OR TIME WASTING! CASH FOR YOUR MTB!SELL YOUR MOUNTAINBIKE OR DO A TRADE IN? ANY WHEEL SIZE, 26ER, 27.5"" OR 29ERS !!ANY FRAME SIZE !!MUST HAVE DISK BRAKES !!NO GAME OR MAKRO BRANDS !!BEST PRICES OFFERED 24/7SEND ME A SMS/WHATSAPP/EMAIL OR GIVE ME A CALL IF YOU WANT TO SELL OR DO A TRADE IN !!0826038599Tags: giant merida mtb mountainbike bicycle cycle specialized cannondale scott bianchi titan duel suspension hardtail softtail trek silverback momsen shimano sram deore gt zaskar karakoram mongoose carbon alloy bmc northern southern suburbs cape town century city strand gordons bay somerset west stellenbosch paarl milnertonTo Connect on Whatsapp, please click:https://api.whatsapp.com/send?phone=27826038599Items Available: 1",1,6810,"2021-03-08 00:11:58","LizelleVDM","Kuils River, Northern Suburbs, Western Cape",NA,NA,NA,"2023-03-08 12:11:58","Western Cape"
"24","https://www.gumtree.co.za/s-mountain-bikes/v1c9800p1page-2/v1c9800p2",2,"https://www.gumtree.co.za/a-mountain-bikes/tokai/2022-scott-aspect-970-29er-mtb/10010239473561011247410409",24,"2022 SCOTT ASPECT 970 29ER MTB",2500,"The SCOTT Aspect 970 is a hardtail mountain bike that is designed to be light, efficient and reasonably priced. Featuring disc brakes and Syncros components, this is the perfect bike for the novice or budget conscious mountain biker.FRAME: Aspect 900-700 series / Alloy 6061 Custom TubingBSA73 / Internal Cable Routing / replaceable hangerFORK: Suntour XCE28100mm travelREAR DERAILLEUR: Shimano Tourney RD-TY30021 SpeedFRONT DERAILLEUR: MicroShift FD-M20 / 31.8mmSHIFTERS: Shimano ST-EF-41-L / 7REZ-fire plus w/gear indicatorCRANKSET: Prowheel TA-CQ0142x34x24 w/CGBB-SET: Feimin FP.B902BB73 / square taperCHAIN: KMC Z-7CASSETTE: Sunrace CSM40 7AV / 11-34TBRAKES: Tektro SCM-02 Mech. DiscROTOR: Tektro / 6 bolt / F&R 160mmHANDLEBAR: HL MTB-AL-312BT / 720mm / black / 12mm riseSncros Pro GripH'STEM: TDS-C301-8FOV / 10° / 31.8 / BlackSEATPOST: HL SP C20731.6mm / 350mm / BlackSEAT: Syncros 3.0HEADSET: Syncros OE Press Fit / 1 1/8""OD 50mm / ID 44mmHUB (FRONT): Formula DC-19 FQR DiscHUB (REAR): Formula DC-27A 7s RQR DiscSPOKES: 14 G / stainless / blackRIMS: Syncros X-20 Disc32H / blackFRONT TIRE: Kenda Booster2.4"" / 30TPIREAR TIRE: Kenda Booster2.4"" / 30TPIPEDALS: Feimin FP-803APPROX WEIGHTS IN KG: 14.95APPROX WEIGHTS IN LBS: 32.96MAX. SYSTEM WEIGHT: 128 kgThe overall weight includes the bike, the rider, the equipment, and possible additional luggage.Items Available: 4",1,3235,"2022-03-08 06:11:59","Bridge Cycles CC","Tokai, Southern Suburbs, Western Cape",NA,NA,NA,"2023-03-08 12:11:59","Western Cape"
"25","https://www.gumtree.co.za/s-mountain-bikes/v1c9800p1page-2/v1c9800p2",2,"https://www.gumtree.co.za/a-mountain-bikes/somerset-west/specialized-evo-duel-suspension-mountain-bike/10011933162831010010372709",25,"SPECIALIZED EVO DUEL SUSPENSION MOUNTAIN BIKE",110000,"2020 SPECIALIZED EVO MEDIUM , MINT CONDITION ,AXS 1 BY 12 EAGLE ,XTR BRAKES , FULL SERVICE HISTORY WITH SPECIALIZED",11,12,"2023-03-08 06:11:59","sholty","Somerset West, Helderberg, Western Cape",NA,NA,NA,"2023-03-08 12:11:59","Western Cape"
"26","https://www.gumtree.co.za/s-mountain-bikes/v1c9800p1page-2/v1c9800p2",2,"https://www.gumtree.co.za/a-mountain-bikes/kuils-river/29er-titan-sonic-pro-duel-suspension-mtb-+-2-x-11-drivetrain-+-rock-shox-air-suspension/10011885022731010003575409",26,"29ER TITAN SONIC PRO DUEL SUSPENSION MTB - 2 x 11 DRIVETRAIN - ROCK SHOX AIR SUSPENSION",16500,"29ER TITAN SONIC PRO DUEL SUSPENSION MOUNTAINBIKE. ***MEDIUM/LARGE 19INCH FRAME // 29ER WHEELS******ZTR RAPID DOUBLE WALL RIMS*****TUBELESS CONVERSION DONE******FULL ROCK SHOX AIR SUSPENSION******2 x 11 DEORE XT DRIVETRAIN***MEDIUM/LARGE 19INCH Alloy Frame Titan SONIC PROROCK SHOX Air Fork with Remote Lockout ROCK SHOX Monarch Air Shock with Lockout ZTR RAPID Tubeless Double Wall RimsTitan/Chaoyang Tubeless TyresShimano DEORE XT HYDRAULIC DISK BrakesShimano DEORE XT 11 SPEED REAR DERAILLEURShimano SLX Rapidfire Shifters Shimano DEORE XT Crank Shimano SLX Front Derailleur Titan TRC Handlebar and Stem Titan TRC Seat and Seat PostSPD Pedals GOOD ALL AROUND CONDITION. MECHANICALLY IN AN EXCELLENT CONDITION.MINOR SERVICE DONE WITH FRESH SEALANT.RACE READY // GET ON AND GO VIEWING AND TESTING WELCOME! Price: R16500For more infoLizelle: 0826038599Items Available: 1",17,291,"2023-02-19 12:12:00","LizelleVDM","Kuils River, Northern Suburbs, Western Cape",NA,NA,NA,"2023-03-08 12:12:00","Western Cape"
"27","https://www.gumtree.co.za/s-mountain-bikes/v1c9800p1page-2/v1c9800p2",2,"https://www.gumtree.co.za/a-mountain-bikes/tokai/axis-seventy-29er-black/1009425492110911247410409",27,"AXIS SEVENTY 29ER BLACK",7999,"Frame:Alloy 6061Fork:SR Suntour XCT HLORear Derailleur:Shimano RD-M310Cassette:Shimano HG-31 8 SPDShifters:Shimano SL-M310Brakes:Tektro Hydraulic Disc BrakesWheel Size :29 inchWe Deliver Nationwide! Kindly Contact us for Details:0217150732, (083) 231 0974 Call / Email / WhatsApp: Cell (083) 457 5007  Hours: Monday-Friday 10.30am-6pm [Fridays Closed 12pm-2pm], Saturday 10am-2.30pmItems Available: 1",1,6743,"2022-03-08 06:12:00","Bridge Cycles CC","Tokai, Southern Suburbs, Western Cape",NA,NA,NA,"2023-03-08 12:12:00","Western Cape"
