"","link","page","ad_url","ad_number","title","price","text","n_photos","n_views","ad_date","seller_name","location","seller_age","n_all_time_ads","n_active_ads","scrape_time","province"
"189","https://www.gumtree.co.za/s-road-bikes/v1c9801p1page-10/v1c9801p10",10,"https://www.gumtree.co.za/a-road-bikes/other/2016-giant-tcr-advanced/1009302190790910917196409",189,"2016 GIANT TCR ADVANCED",21000,"Good DayI'm selling my 2016 Giant TCR Advanced. I bought the bike from John O Connor Cycles in 2018.The bike was serviced once a week for the period up until beginning 2019. Then after that it was serviced every months to 3 months.I however am a bicycle mechanic and I serviced the bicycle myself for this periods as i worked at the bike shop where I bought the bike.Herewith the specs:Model: 2016 Giant TCR AdvancedSize 56Handlebar: Fizik Cyrano R1 Carbon HandlebarSaddle: PrologoGroupset: Shimano 105 11, 50/34T chainrings - 28T 11 speed rear cassetteBike was last serviced end 2020 and the chain was replaced and is running 100% with current groupset.I will be throwing in some extras with the bike if interested.*Kindly make me an offer* and I will consider your offer and get back to you. No time wasters or ridiculous offers please.Thanks in advance.RegardsJeroen",8,114,"2021-05-05 12:48:45","Jeroen van Biene","Other, Cape Town, Western Cape",5,NA,NA,"2021-05-12 12:48:45","Western Cape"
"190","https://www.gumtree.co.za/s-road-bikes/v1c9801p1page-10/v1c9801p10",10,"https://www.gumtree.co.za/a-road-bikes/port-elizabeth/axis-road-frame/1009301643220912844894909",190,"Axis road frame",800,"Light aluminum Frame for sale the parts come for free , in good quality, medium sized , comes with 2 rims for free",1,167,"2021-05-05 12:48:46","Sivuyise Kula","Port Elizabeth, Eastern Cape, Eastern Cape",7,NA,NA,"2021-05-12 12:48:46","Eastern Cape, Eastern Cape"
"191","https://www.gumtree.co.za/s-road-bikes/v1c9801p1page-10/v1c9801p10",10,"https://www.gumtree.co.za/a-road-bikes/other/campagnola-wheel-set/1009301612030912617974809",191,"Campagnola wheel set",2000,"Campagnola stainless steel wheel set.. perfect for the slightly heavier cyclist.. takes up to 10 speed.. R2000 or nearest cash offerCall or whatsapp only 0727639181",1,58,"2021-05-05 12:48:47","Quinton Jaftha","Other, Southern Peninsula, Western Cape",9,NA,NA,"2021-05-12 12:48:47","Western Cape"
"192","https://www.gumtree.co.za/s-road-bikes/v1c9801p1page-10/v1c9801p10",10,"https://www.gumtree.co.za/a-road-bikes/eastern-pretoria/mongoose-article/1009301321460910043107309",192,"Mongoose Article",2950,"Mongoose Article BMX bike for sale.Mint condition.Contact Ruhan - 072 443 6514.",3,68,"2021-05-05 12:48:47","rjb","Eastern Pretoria, Pretoria / Tshwane, Gauteng",10,NA,NA,"2021-05-12 12:48:47","Gauteng"
"193","https://www.gumtree.co.za/s-road-bikes/v1c9801p1page-10/v1c9801p10",10,"https://www.gumtree.co.za/a-road-bikes/other/fixie-trek-1000/1009301260850911491079609",193,"Fixie (TREK 1000)",3200,"Fixie 1000Complete bike Crank and peddles included Converted into a fixieWhatsApp if interested ",3,143,"2021-05-05 12:48:48","Bilal Gamildien","Other, Southern Suburbs, Western Cape",2,NA,NA,"2021-05-12 12:48:48","Western Cape"
"194","https://www.gumtree.co.za/s-road-bikes/v1c9801p1page-10/v1c9801p10",10,"https://www.gumtree.co.za/a-road-bikes/george/marcello-xl-full-carbon-road-bike/1009301274230910085866309",194,"Marcello xl full carbon road bike",23000,"Marcello full carbon road bike with Campagnola  11 speed super record groupset, campagnola Eurus wheels, Cinelli   handlebars and Time cleats.2 x Wheel bags.Specialised size 10(45) racing shoes.All in very good condition.",11,66,"2021-05-05 12:48:49","Maans Louwrens","George, Eden, Western Cape",11,NA,NA,"2021-05-12 12:48:49","Western Cape"
"195","https://www.gumtree.co.za/s-road-bikes/v1c9801p1page-10/v1c9801p10",10,"https://www.gumtree.co.za/a-road-bikes/bedfordview/look-tt-triathlon-bike-medium/1003424008200910007214309",195,"Look TT Triathlon bike Medium",50000,"Medium TT Triathlon full Carbon bike , R180 k new  - clinchers 
SRAM components - with extra tubes and pump 
Suitable for 168cm - 180 cm ",8,4385,"2018-05-12 18:48:49","plusfactor","Bedfordview, East Rand, Gauteng",9,NA,NA,"2021-05-12 12:48:50","Gauteng"
"196","https://www.gumtree.co.za/s-road-bikes/v1c9801p1page-10/v1c9801p10",10,"https://www.gumtree.co.za/a-road-bikes/durbanville/brand-new-bicycles-mens-and-ladies/1009300870610911288764509",196,"Brand new bicycles, mens and ladies",2400,"One new Raleigh(29) mens bicycle x 21 speed, with Revolution shift. R1400.00One new (24) ladies bicycle. R1000.00Christmas presents and never been used. Kept in garage.",3,54,"2021-05-05 12:48:50","Mossie Kruger","Durbanville, Northern Suburbs, Western Cape",3,NA,NA,"2021-05-12 12:48:50","Western Cape"
"197","https://www.gumtree.co.za/s-road-bikes/v1c9801p1page-10/v1c9801p10",10,"https://www.gumtree.co.za/a-road-bikes/durbanville/12-toddler-bike-with-training-wheels-for-sale/1009300161620910338635909",197,"12"" toddler bike with training wheels for sale",500,"12"" bike for sale
Perfect for a beginner toddler cyclist 
Hardly used
Also comes with training wheels",2,40,"2021-05-05 12:48:51","Minnette Schoeman","Durbanville, Northern Suburbs, Western Cape",6,NA,NA,"2021-05-12 12:48:51","Western Cape"
"198","https://www.gumtree.co.za/s-road-bikes/v1c9801p1page-10/v1c9801p10",10,"https://www.gumtree.co.za/a-road-bikes/other/toddlers-bicycle/1009299497940912682813109",198,"Toddlers bicycle",750,"Selling unisex bicycle for kids from 3 years. Item is in excellent condition, got training wheels, breaks and angry birds printed seat. Not being used and was purchased in December 2020.",6,37,"2021-05-05 12:48:52","Kelly-anne Willett","Other, Johannesburg, Gauteng",7,NA,NA,"2021-05-12 12:48:52","Gauteng"
"199","https://www.gumtree.co.za/s-road-bikes/v1c9801p1page-10/v1c9801p10",10,"https://www.gumtree.co.za/a-road-bikes/randburg/merida-road-bike/1009299298270910041645909",199,"Merida Road Bike",8500,"Merida Scultura 300 for sale. Size Large(56). Very good condition, serviced before and after long races.R8000 onco. ",2,98,"2021-05-05 12:48:52","DeonvanWyk","Randburg, Johannesburg, Gauteng",9,NA,NA,"2021-05-12 12:48:52","Gauteng"
"200","https://www.gumtree.co.za/s-road-bikes/v1c9801p1page-10/v1c9801p10",10,"https://www.gumtree.co.za/a-road-bikes/constantia-kloof/collectors-classic-shimano-ultegra-group-set/1003555108040910002524809",200,"Collectors Classic Shimano Ultegra Group Set ",6500,"Exocet Racing Bike.
Size 53 – centre BB to top of top tube. 6261 Aluminium frame. Carbon fork.
Shimano 600 8 spd STI group set.
Continental Ultra 3000 Tyres. Cinelli Handle bars and stem (110mm). Campy 32
hole profile rims. Double butted elliptical (aero) stainless steel spokes. Look
Carbon Pro Pedals. Spare tyres.

This is a great light
weight bike which has been well maintained and is in very good condition.

Basil 072 198
7545",4,1991,"2019-05-13 00:48:54","basilpret","Constantia Kloof, Johannesburg, Gauteng",9,NA,NA,"2021-05-12 12:48:54","Gauteng"
"201","https://www.gumtree.co.za/s-road-bikes/v1c9801p1page-10/v1c9801p10",10,"https://www.gumtree.co.za/a-road-bikes/constantia-kloof/racing-bike-+-aluminium-frame-carbon-fork/1002301682650910002524809",201,"Racing Bike - Aluminium Frame, Carbon Fork",6500,"Exocet Racing Bike.
Size 53 – centre BB to top of top tube. 6261 Aluminium frame. Carbon fork.
Shimano 600 Ultegra 8 spd STI group set.
Continental Ultra 3000 Tyres. Cinelli Handle bars and stem (110mm). Campy 32
hole profile rims. Double butted elliptical (aero) stainless steel spokes. Look
Carbon Pro Pedals. Spare tyres and tubes.

This is a great light
weight bike which has been well maintained and is in very good condition.

Basil 072 198
7545.",4,1957,"2018-05-12 18:48:54","basilpret","Constantia Kloof, Johannesburg, Gauteng",9,NA,NA,"2021-05-12 12:48:54","Gauteng"
"202","https://www.gumtree.co.za/s-road-bikes/v1c9801p1page-10/v1c9801p10",10,"https://www.gumtree.co.za/a-road-bikes/port-elizabeth/2016-scott-speedster-30-large-roadbike/1008841279070912505662609",202,"2016 Scott Speedster 30 Large Roadbike",14000,"2016 Scott Speedster 30 Large(56 frame) Roadbike, Shimano clipon pedals, repair kit, tyre pump, new spare tube, computer, original parts, brand new condition! Helmet and shoes not included, optional. 
",1,501,"2021-02-10 05:18:55","Desmond Roelofse","Port Elizabeth, Eastern Cape, Eastern Cape",1,NA,NA,"2021-05-12 12:48:55","Eastern Cape, Eastern Cape"
"203","https://www.gumtree.co.za/s-road-bikes/v1c9801p1page-11/v1c9801p11",11,"https://www.gumtree.co.za/a-road-bikes/kuils-river/durace-road-cranks/1009004785770910005439609",203,"Durace Road Cranks ",2475,"Ratio 53/39
Arm Length 172.5mm
Very good condition 


I take crypto currency coins
",5,230,"2021-03-12 15:48:56","ToysRus","Kuils River, Northern Suburbs, Western Cape",13,NA,NA,"2021-05-12 12:48:56","Western Cape"
"204","https://www.gumtree.co.za/s-road-bikes/v1c9801p1page-11/v1c9801p11",11,"https://www.gumtree.co.za/a-road-bikes/mosselbaai/old-peugeot-tandem-for-sale/1009158856020910408307809",204,"Old Peugeot tandem for sale",3000,"Old Peugeot tandem for sale this bike has been Sitting in my flat for 3 Years and we are busy moving overseas so it needs a new home it needs New tires and Service and @#@##@!!! good clean :).


Shipping is on buyers' accounts and open offers.
",5,356,"2021-04-12 02:18:57","hansie von schutz","Mosselbaai, Eden, Western Cape",6,NA,NA,"2021-05-12 12:48:57","Western Cape"
"205","https://www.gumtree.co.za/s-road-bikes/v1c9801p1page-11/v1c9801p11",11,"https://www.gumtree.co.za/a-road-bikes/springs/bike-leather-jacket/1009296759540910065918109",205,"Bike Leather Jacket",6500,"Brand new bike leather jacket size USA 38.R 1400.00 neg.",3,28,"2021-05-05 12:48:58","kurkim","Springs, East Rand, Gauteng",9,NA,NA,"2021-05-12 12:48:58","Gauteng"
"206","https://www.gumtree.co.za/s-road-bikes/v1c9801p1page-11/v1c9801p11",11,"https://www.gumtree.co.za/a-road-bikes/other/24-inch-scott-road-bike/1009295888330912566881509",206,"24 Inch Scott Road Bike",5000,"Scott Kids 24 inch junior road bike. 8 speed sora gears. Pedals excluded. In excellent condition. ",5,76,"2021-05-04 12:48:59","Ronald James Harvey","Other, West Rand, Gauteng",1,NA,NA,"2021-05-12 12:48:59","Gauteng"
"207","https://www.gumtree.co.za/s-road-bikes/v1c9801p1page-11/v1c9801p11",11,"https://www.gumtree.co.za/a-road-bikes/johannesburg-cbd/16inch-boys-bicycle/1009295576390912482780709",207,"16inch Boys Bicycle ",800,"I'm selling a 16inch boys bicycle still brand new ",2,27,"2021-05-04 12:48:59","Bongi","Johannesburg CBD, Johannesburg, Gauteng",1,NA,NA,"2021-05-12 12:48:59","Gauteng"
"208","https://www.gumtree.co.za/s-road-bikes/v1c9801p1page-11/v1c9801p11",11,"https://www.gumtree.co.za/a-road-bikes/constantia/s+works-venge-56cm/1009295679460911373463709",208,"S-Works Venge 56cm",34000,"2015 S-Works Venge in excellent condition. Meticulously cared for. SRAM Red throughout with dark horse wheels. very light and very fast. ",7,146,"2021-05-04 12:49:00","gary","Constantia, Southern Suburbs, Western Cape",3,NA,NA,"2021-05-12 12:49:00","Western Cape"
"209","https://www.gumtree.co.za/s-road-bikes/v1c9801p1page-11/v1c9801p11",11,"https://www.gumtree.co.za/a-road-bikes/oudtshoorn/surge-bmx/1009295576180912692553709",209,"Surge bmx ",3500,"

Surge bmx
Primo grips+bar ends. Primo tyres
100%werkende kondisie
Paar skrape
Kort nuwe briek
Ekstra 2 gebruikte tyres en 4 pegs
Goeie cranks
Nuwe agter tube
Tyre sire is primo V.mosnter 20×2.10",8,96,"2021-05-04 12:49:01","Roxanne Scarlet Tiberio","Oudtshoorn, Eden, Western Cape",7,NA,NA,"2021-05-12 12:49:01","Western Cape"
"210","https://www.gumtree.co.za/s-road-bikes/v1c9801p1page-11/v1c9801p11",11,"https://www.gumtree.co.za/a-road-bikes/boksburg/road-bicycle/1009295407030910844767309",210,"Road Bicycle",22500,"Carbon Road bike large frame. Shimano 11 SpeedWeight : 7.85kg / 17.3lb.Groupset : Shimano 105.Gear ratios : 11-28t cassette, 52/36t chainset.Lifetime warrantyLifetime warranty on: frame, stem, handlebars and fork. Details on btwin.comFRAMEB'Twin Ultra Evo Dynamic frame is the most advanced frame available to tackle mountains and win the most demanding classic races..A blend of HM and IM carbon fibres for one of the best weight-to-speed ratios on the market.The frame was specially designed for the most demanding climbers and sprinters. The bottom bracket is a standard PressFit 86 for greater stiffness of the chassis.FORK / SUSPENSIONThe B'Twin Ultra Evo Dynamic fork is exclusive to the B'Twin Ultra Evo Dynamic frame.Weight: 320 g.Full carbon fork.HANDLEBAR / STEM / STEERINGDRIVETRAIN11-speed Shimano 105 groupset.The 105 offers the same precise indexing as the Ultegra and Dura-Ace groupsets.The derailleurs feature an all-new design. The front derailleur has a guide combined with a new spring mechanism that ensures smooth shifting between chainrings.The rear derailleur now sports the same tried-and-tested mechanism found on the Dura-Ace groupset (cassette with 32 teeth max. for high-mountain cycling).CRANKSET / CASSETTEShimano 105 11-speed ultra-versatile, 11x28 cassette.11 ; 12 ; 13 ; 14 ; 15 ; 17 ; 19 ; 21 ; 23 ; 25 ; 28.Crankset: Shimano 105 5800, 52x36.",11,65,"2021-05-04 12:49:01","Derrick ","Boksburg, East Rand, Gauteng",5,NA,NA,"2021-05-12 12:49:01","Gauteng"
"211","https://www.gumtree.co.za/s-road-bikes/v1c9801p1page-11/v1c9801p11",11,"https://www.gumtree.co.za/a-road-bikes/pinelands/single-speed-bicycle/1009294506060910010559809",211,"Single speed bicycle",2100,"Very good condition Colony single speed. Ideal for short trips.",3,119,"2021-05-04 12:49:02","moth","Pinelands, Southern Suburbs, Western Cape",12,NA,NA,"2021-05-12 12:49:02","Western Cape"
"212","https://www.gumtree.co.za/s-road-bikes/v1c9801p1page-11/v1c9801p11",11,"https://www.gumtree.co.za/a-road-bikes/tableview/giant-escape-women-39-s-road-bike-+-small-single-speed/1009294030200910006925909",212,"Giant Escape women's road bike - small, single speed",2200,"Giant Escape women's road bike - small, single speed, clip in pedals. Very good condition. To be collected in Table View",8,44,"2021-05-04 12:49:03","Amanda Niemand","Tableview, West Coast, Western Cape",12,NA,NA,"2021-05-12 12:49:03","Western Cape"
"213","https://www.gumtree.co.za/s-road-bikes/v1c9801p1page-11/v1c9801p11",11,"https://www.gumtree.co.za/a-road-bikes/athlone/perfect-student-bike-for-hire/1009293616620910330322109",213,"PERFECT STUDENT BIKE FOR HIRE",1000,"BACK PEDAL 
BELL
BASKET
NICE COMFY SEAT
MONTH TO MONTH RENTAL

",1,36,"2021-05-04 12:49:04","A Sayed","Athlone, Cape Flats, Western Cape",6,NA,NA,"2021-05-12 12:49:04","Western Cape"
"214","https://www.gumtree.co.za/s-road-bikes/v1c9801p1page-11/v1c9801p11",11,"https://www.gumtree.co.za/a-road-bikes/athlone/schwinn-fastback-roadbike/1009293864040910330322109",214,"SCHWINN FASTBACK ROADBIKE",3750,"BIKE IS STILL IN EXCELLENT CONDITION 
SIZE 60 LARGE
SHIMANO CLARIS GROUPSET 
8 X 2",4,127,"2021-05-04 12:49:05","A Sayed","Athlone, Cape Flats, Western Cape",6,NA,NA,"2021-05-12 12:49:05","Western Cape"
"215","https://www.gumtree.co.za/s-road-bikes/v1c9801p1page-11/v1c9801p11",11,"https://www.gumtree.co.za/a-road-bikes/salt-river/lekker-jordaan-bicycle-e+bike/1009293152810910887568509",215,"'LEKKER' Jordaan Bicycle ( E-BIKE)",15000,"● Retrofitted E-bike conversion 
● 3 SPEED
● Comes with charger 
● Bracket to hang from wall
● Bike pump incl.",1,63,"2021-05-04 12:49:06","bicycle Express Woodstock","Salt River, Cape Town, Western Cape",5,NA,NA,"2021-05-12 12:49:06","Western Cape"
"216","https://www.gumtree.co.za/s-road-bikes/v1c9801p1page-11/v1c9801p11",11,"https://www.gumtree.co.za/a-road-bikes/randburg/boys-bicycle-for-sale/1009293203680912453143009",216,"Boys Bicycle For sale",3500,"Hi there!I'm selling a brand new bicycle for a boy.Please contact me if you are interested, no time wasters.Titan 26inch (please see photo attached)Keri 082 552 7389or emaildsmart@teraoka.co.zaPrice is R3500",1,125,"2021-05-04 12:49:06","Astrid Le keur","Randburg, Johannesburg, Gauteng",1,NA,NA,"2021-05-12 12:49:06","Gauteng"
"217","https://www.gumtree.co.za/s-road-bikes/v1c9801p1page-11/v1c9801p11",11,"https://www.gumtree.co.za/a-road-bikes/randburg/girls-bike-for-sale/1009293173940912453143009",217,"Girls Bike For sale",3500,"Hi there!I'm selling a brand new bicycle for a girl.Please contact me if you are interested, no time wasters.Titan 26inch (please see photo attached)Keri 082 552 7389or emaildsmart@teraoka.co.zaPrice is R3500",1,84,"2021-05-04 12:49:07","Astrid Le keur","Randburg, Johannesburg, Gauteng",1,NA,NA,"2021-05-12 12:49:07","Gauteng"
"218","https://www.gumtree.co.za/s-road-bikes/v1c9801p1page-11/v1c9801p11",11,"https://www.gumtree.co.za/a-road-bikes/morningside/giant-road-bike-ocr/1009292877550912619069509",218,"Giant road bike ocr",5000,"Giant road bike ocr Frame size 44cm Located in Essenwood Durban Contact 0789058754 ",1,54,"2021-05-04 12:49:08","Naseema Khan","Morningside, Durban City, KwaZulu-Natal",9,NA,NA,"2021-05-12 12:49:08","KwaZulu-Natal"
"219","https://www.gumtree.co.za/s-road-bikes/v1c9801p1page-11/v1c9801p11",11,"https://www.gumtree.co.za/a-road-bikes/morningside/haro-road-bike/1009292869720912619069509",219,"Haro road bike",5000,"Haro road bike Frame size L Excellent condition Located in Essenwood Durban Contact 0789058754 ",1,52,"2021-05-04 12:49:08","Naseema Khan","Morningside, Durban City, KwaZulu-Natal",9,NA,NA,"2021-05-12 12:49:09","KwaZulu-Natal"
"220","https://www.gumtree.co.za/s-road-bikes/v1c9801p1page-11/v1c9801p11",11,"https://www.gumtree.co.za/a-road-bikes/vereeniging/road-bikes-for-sale-felt-s32-amp-cyclone-avalanche/1009292832760910921130709",220,"Road Bikes For Sale Felt S32 & Cyclone Avalanche",6200,"Cyclone Avalanche Specs -54 FrameShimano Sora flight Deck triple shifters gear setGator skin tyresLimited edition 3rd big front gearKinlin light deep alloy rims.Felt S32 Road/Triathlon Bike54 FrameCarbon fiber forks and ultra light custom butted alloy frame Shimano gear setUltra light rims and TT4 tyresCat eye 2 computerR6200 for both or make an offer",8,44,"2021-05-04 12:49:09","Daygen Naicker","Vereeniging, Sedibeng, Gauteng",5,NA,NA,"2021-05-12 12:49:09","Gauteng"
"221","https://www.gumtree.co.za/s-road-bikes/v1c9801p1page-11/v1c9801p11",11,"https://www.gumtree.co.za/a-road-bikes/langebaan/continental-gatorskins/1009292682330910050547309",221,NA,NA,"failed",NA,NA,NA,NA,NA,NA,NA,NA,NA,"NA"
"222","https://www.gumtree.co.za/s-road-bikes/v1c9801p1page-11/v1c9801p11",11,"https://www.gumtree.co.za/a-road-bikes/port-shepstone/bike-for-sale/1009292815480910027089409",222,"Bike For Sale",2850,"This Raleigh Super light weigh bike is for sale.  It is in good condition and is equipped with a speed and distance meter.",8,74,"2021-05-04 12:49:12","Gideon Meyer","Port Shepstone, South Coast (Ugu), KwaZulu-Natal",10,NA,NA,"2021-05-12 12:49:12","KwaZulu-Natal"
"223","https://www.gumtree.co.za/s-road-bikes/v1c9801p1page-12/v1c9801p12",12,"https://www.gumtree.co.za/a-road-bikes/port-shepstone/bicycle-for-sale/1009292765860910027089409",223,"Bicycle For Sale",1850,"Patriot Hybrid road and mountain bike for sale - sit is good condition. Equipped with meter for speed and distance. New tires fitted.",9,101,"2021-05-04 12:49:13","Gideon Meyer","Port Shepstone, South Coast (Ugu), KwaZulu-Natal",10,NA,NA,"2021-05-12 12:49:13","KwaZulu-Natal"
"224","https://www.gumtree.co.za/s-road-bikes/v1c9801p1page-12/v1c9801p12",12,"https://www.gumtree.co.za/a-road-bikes/port-elizabeth/boys-bmx-diamondback/1009292735450910251214009",224,"boys bmx diamondback",700,"Selling bmx diamondback cobra - contact for more pictures or to view",2,75,"2021-05-04 12:49:14","duard hancox","Port Elizabeth, Eastern Cape, Eastern Cape",7,NA,NA,"2021-05-12 12:49:14","Eastern Cape, Eastern Cape"
"225","https://www.gumtree.co.za/s-road-bikes/v1c9801p1page-12/v1c9801p12",12,"https://www.gumtree.co.za/a-road-bikes/kingsborough/echo-czar-pro-26inch/1009050227230910026642209",225,"Echo Czar Pro 26inch ",15000,"Upgraded trp  brakes.  Good condition.
WhatsApp 0814148331
15k neg",6,90,"2021-03-12 15:49:14","tyrone snyman","Kingsborough, South Suburbs, KwaZulu-Natal",9,NA,NA,"2021-05-12 12:49:14","KwaZulu-Natal"
"226","https://www.gumtree.co.za/s-road-bikes/v1c9801p1page-12/v1c9801p12",12,"https://www.gumtree.co.za/a-road-bikes/bhisho/felt-f4-series/1009291914370910255744009",226,"Felt F4 series ",13500,"Felt road bike for sale good condition  size 56 Price is negotiable ",8,131,"2021-05-04 12:49:15","bennie","Bhisho, Eastern Cape, Eastern Cape",7,NA,NA,"2021-05-12 12:49:15","Eastern Cape, Eastern Cape"
"227","https://www.gumtree.co.za/s-road-bikes/v1c9801p1page-12/v1c9801p12",12,"https://www.gumtree.co.za/a-road-bikes/gordon-s-bay/cannondale-road-bike-+-r800-series-+-52cm/1009292062050910918288409",227,"Cannondale Road Bike  - R800 Series  - 52cm",6000,"Handmade in the USA - This Cannondale R800 Aluminium Frame, Carbon fork is in excellent condition. Boasting Shimano 105 Groupset (2x9) and Mavic CXP21 Rims.** Please note, price amended as sifters don't have cap ends. (but works perfectly)Just fitted a brand new cassette, Chain and Chain wheels.Priced to sell !!!",12,122,"2021-05-04 12:49:16","Michael du Plessis","Gordon's Bay, Helderberg, Western Cape",5,NA,NA,"2021-05-12 12:49:16","Western Cape"
"228","https://www.gumtree.co.za/s-road-bikes/v1c9801p1page-12/v1c9801p12",12,"https://www.gumtree.co.za/a-road-bikes/gordon-s-bay/shimano-600-+-crancks-with-bb-+-170mm/1009291992600910918288409",228,"Shimano 600 - Crancks with BB - 170mm",700,"Shimano 600 Fc-6207 Crankset 170mm Vintage Leroica 170mm with BB for sale.** Please note, the chain-rings are not Shimano but a 53t Middleburn Outer chainwheel.Shipping for Buyer account",8,57,"2021-05-04 12:49:16","Michael du Plessis","Gordon's Bay, Helderberg, Western Cape",5,NA,NA,"2021-05-12 12:49:17","Western Cape"
"229","https://www.gumtree.co.za/s-road-bikes/v1c9801p1page-12/v1c9801p12",12,"https://www.gumtree.co.za/a-road-bikes/gordon-s-bay/giant-cfr-composite-+-61cm-frame-amp-fork/1009291974600910918288409",229,"Giant CFR Composite - 61cm Frame & Fork",1850,"If you are looking for a larger than normal frame and particular about weight saving, then this is the one for you.This CFR, although not in perfect condition, is the prefect training bike and ideal project build. The frame is stiff, strong and fast but most of all light and responsive. The Blade carbon fork adds to the aerodynamics and its a no ""mess no fuss"" weekend warrior.The frame and fork is being sold with the original headset and I date this back to a 1997 model",10,59,"2021-05-04 12:49:17","Michael du Plessis","Gordon's Bay, Helderberg, Western Cape",5,NA,NA,"2021-05-12 12:49:17","Western Cape"
"230","https://www.gumtree.co.za/s-road-bikes/v1c9801p1page-12/v1c9801p12",12,"https://www.gumtree.co.za/a-road-bikes/gordon-s-bay/trek-2000-+-easton-aluminium-program-size-56cm/1009291957990910918288409",230,"Trek 2000 - Easton Aluminium ProGram Size 56cm",1500,"Calling Old School !!These days it seems you can’t go anywhere without seeing a Trek being ridden by a rider of any age. Winning seven tours has made a big difference.The 2000 sits bang in the middle of Trek’s impressively large road bike range.But it is the kind of bike that anybody can jump on and straight away feel at home. The handling is very stable, very reliable and very predictable. Limits can safely be explored, and the bike issues so much confidence you can feel safe about hooning around back lanes, congested city streets or the race track with the assured feeling any good bike should endow you with.Super light and ready to be built into your dream Steed.**Old School Saddle, Stem and Seat post included as seen",10,69,"2021-05-04 12:49:18","Michael du Plessis","Gordon's Bay, Helderberg, Western Cape",5,NA,NA,"2021-05-12 12:49:18","Western Cape"
"231","https://www.gumtree.co.za/s-road-bikes/v1c9801p1page-12/v1c9801p12",12,"https://www.gumtree.co.za/a-road-bikes/brackenfell/road-bike-in-a-good-condition/1009291570100912735703809",231,"Road Bike in a good condition",3999,"Road Bike in a good condition
Single-speed
Front lockout switch
Rear disc brake

Collection Brackenfell",4,73,"2021-05-04 12:49:19","loren martin","Brackenfell, Northern Suburbs, Western Cape",5,NA,NA,"2021-05-12 12:49:19","Western Cape"
"232","https://www.gumtree.co.za/s-road-bikes/v1c9801p1page-12/v1c9801p12",12,"https://www.gumtree.co.za/a-road-bikes/mosselbaai/giant-tcrc1-carbon-road-bike/1009291563010910171472309",232,"Giant TCRc1 Carbon Road Bike",12000,"Full Carbon Giant TCR c1 Road Bike, Size Large(53,5)
Shimano Ultegra Groupset
Ksyrium Rims
Gator skin tyres
Computer
Bike Spares Bag
Pump
2 Waterbottel Holders
Great Condition

Great Brakriver, Western Cape
0824416935
",5,110,"2021-05-04 12:49:20","Jack Betz","Mosselbaai, Eden, Western Cape",10,NA,NA,"2021-05-12 12:49:20","Western Cape"
"233","https://www.gumtree.co.za/s-road-bikes/v1c9801p1page-12/v1c9801p12",12,"https://www.gumtree.co.za/a-road-bikes/brackenfell/electric-fold+up-bicycle-for-sale/1009291494930912735703809",233,"Electric fold-up bicycle for sale",7999,"Electric fold-up bicycle for sale
Independent throttle so no need to pedal
The battery lasts a few hours 
Foldable frame
Comfortable seat
Goes up to 30kmph
Bracket to attach a basket
Durable good condition tyres
Hooter and light

In a good condition",6,65,"2021-05-04 12:49:20","loren martin","Brackenfell, Northern Suburbs, Western Cape",5,NA,NA,"2021-05-12 12:49:20","Western Cape"
