"","link","page","ad_url","ad_number","title","price","text","n_photos","n_views","ad_date","seller_name","location","seller_age","n_all_time_ads","n_active_ads","scrape_time","province"
"1","https://www.gumtree.co.za/s-mountain-bikes/v1c9800p1page-1/v1c9800p1",1,"https://www.gumtree.co.za/a-mountain-bikes/somerset-west/mtb-+-ad-posted-by-ich/10010045645201012390885309",1,"MTB - Ad posted by Ich",7000,"MTB Giant 21 Gearsits like new 3 month only used on tarstreet",6,616,"2021-10-20 12:35:51","Ich","Somerset West, Helderberg, Western Cape",NA,NA,NA,"2021-10-26 12:35:51","Western Cape"
"2","https://www.gumtree.co.za/s-mountain-bikes/v1c9800p1page-1/v1c9800p1",1,"https://www.gumtree.co.za/a-mountain-bikes/airport-industria/pandemo-350-mountain-e+bike/1009996155740910124180709",2,"PANDEMO 350 Mountain E-Bike",24900,"Well established on the South African market, we proudly offer the Pandemo 350 mountain e-bike. Its great features include 6 different assistance settings, supplied by a powerful 350-watt motor housed in the rear wheel hub, and driven through Shimano 21-speed gear set system. A bright LED light and illuminated LCD screen facilitates night cycling. The electronic system provides essential cumulative and trip data including speed, distance, time, battery condition and instantaneous power consumption.Great handling characteristics: Improved steering is achieved through a 680mm handlebar, and you’ll always feel safe on these great bikes knowing that Tektro 160 front and rear disks are fitted!Value for money: The standard accessories included are a removable 36v long-lasting battery, bike kickstand, reflectors, bottle cradle, a USB charging port for your mobile device, and spring loaded throttle switch.It is available in 3 different sizes to suit all cyclists, male or female. Great e-bikes and scooters from SA Ebikes. Call Kobus at 0764245136 or visit our website at www.saebikes.co.za for more information, and to place your order now!We deliver countrywide.Chubby bag and waterbottle excluded.",12,728,"2021-10-08 12:35:51","Arie","Airport industria, Cape Flats, Western Cape",NA,NA,NA,"2021-10-26 12:35:52","Western Cape"
"3","https://www.gumtree.co.za/s-mountain-bikes/v1c9800p1page-1/v1c9800p1",1,"https://www.gumtree.co.za/a-mountain-bikes/blouberg/new-baroudeur-rhino-500w-750w-e+bikes-summer-is-around-the-corner/1009497912700910005874609",3,"NEW Baroudeur Rhino 500W/750W e-bikes | Summer is around the corner",32500,"BAROUDEUR Bicycles is a South African-based company that started in 2019 and was born from an absolute passion for all things family, outdoor, cycling and endorphin inducing.The Baroudeur Team has a passion for producing bikes that can navigate the rugged African terrain while honouring a pocket friendly approach to maintenance, as well providing a sustainable, carbon-neutral, enjoyable and comfortable riding experience.Motor: 48V 500W or 750W Battery: 48V 16AH Lithium Ion (charge time 4 hours)Controller: Pedal assist and thumb throttleLCD Display: 5 speed levels, battery level, speed, rangeMax speed: 35km/hRange per charge: 65km +Loading capacity: 130kgBike weight: 28kgFrame: Aluminium AlloyTyres: Chao Yung Big Daddy dual compound 26"" x 4""Derailleur: 7 speed Shimano AceraBrakes: Tektra Hydraulic Discs• 3 months warranty on moving parts• 1 year warranty on electronic equipment• Lifetime warranty on frame for first owner500W: R32,500.00  |  750W: R36,000.00Please contact me (Sean) for a full list of specifications or if you would like more info or a demo ride. Video: https://www.facebook.com/baroudeur.bicycles/videos",12,2251,"2021-06-26 18:35:52","Ocean Graphics & Baroudeur E-bikes","Blouberg, West Coast, Western Cape",NA,NA,NA,"2021-10-26 12:35:52","Western Cape"
"4","https://www.gumtree.co.za/s-mountain-bikes/v1c9800p1page-1/v1c9800p1",1,"https://www.gumtree.co.za/a-mountain-bikes/port-elizabeth/trek-skye-sl-ladies-bicycle/10010071745271010959303209",4,"Trek Skye SL ladies bicycle ",7500,"In outstanding condition 
15,5”. Wheels Bontager ",1,3,"2021-10-26 12:30:52","Cecilia Adams","Port Elizabeth, Eastern Cape, Eastern Cape",NA,NA,NA,"2021-10-26 12:35:52","Eastern Cape, Eastern Cape"
"5","https://www.gumtree.co.za/s-mountain-bikes/v1c9800p1page-1/v1c9800p1",1,"https://www.gumtree.co.za/a-mountain-bikes/kuils-river/selling-your-bike-i-pay-cash/1007707981440910003575409",5,"SELLING YOUR BIKE? I PAY CASH",17500,"I PAY CASH FOR YOUR UNWANTED MOUNTAINBIKE !ANYWHERE IN THE WESTERN CAPE. I WILL COME TO YOU !No need to advertise and have countless people wasting your time with silly offers!!!NO SCAMMING OR TIME WASTING! CASH FOR YOUR MTB!SELL YOUR MOUNTAINBIKE OR DO A TRADE IN? ANY WHEEL SIZE, 26ER, 27.5"" OR 29ERS !!ANY FRAME SIZE !!MUST HAVE DISK BRAKES !!NO GAME OR MAKRO BRANDS !!BEST PRICES OFFERED 24/7SEND ME A SMS/WHATSAPP/EMAIL OR GIVE ME A CALL IF YOU WANT TO SELL OR DO A TRADE IN !!0826038599Tags: giant merida mtb mountainbike bicycle cycle specialized cannondale scott bianchi titan duel suspension hardtail softtail trek silverback momsen shimano sram deore gt zaskar karakoram mongoose carbon alloy bmc northern southern suburbs cape town century city strand gordons bay somerset west stellenbosch paarl milnertonTo Connect on Whatsapp, please click:https://api.whatsapp.com/send?phone=27826038599Items Available: 1",1,5064,"2020-10-26 06:35:53","LizelleVDM","Kuils River, Northern Suburbs, Western Cape",NA,NA,NA,"2021-10-26 12:35:53","Western Cape"
"6","https://www.gumtree.co.za/s-mountain-bikes/v1c9800p1page-1/v1c9800p1",1,"https://www.gumtree.co.za/a-mountain-bikes/tokai/axis-seventy-29er-black/1009425492110911247410409",6,"AXIS SEVENTY 29ER BLACK",7999,"Frame:Alloy 6061Fork:SR Suntour XCT HLORear Derailleur:Shimano RD-M310Cassette:Shimano HG-31 8 SPDShifters:Shimano SL-M310Brakes:Tektro Hydraulic Disc BrakesWheel Size :29 inchWe Deliver Nationwide! Kindly Contact us for Details:0217150732, (083) 231 0974 Call / Email / WhatsApp: Cell (083) 457 5007  Hours: Monday-Friday 10.30am-6pm [Fridays Closed 12pm-2pm], Saturday 10am-2.30pmItems Available: 1",1,2114,"2021-06-26 18:35:53","Bridge Cycles CC","Tokai, Southern Suburbs, Western Cape",NA,NA,NA,"2021-10-26 12:35:53","Western Cape"
"7","https://www.gumtree.co.za/s-mountain-bikes/v1c9800p1page-1/v1c9800p1",1,"https://www.gumtree.co.za/a-mountain-bikes/tableview/mountain-maniacs-+-mountain-bike-+-red-+-26-inch/10010056189241011364600209",7,"Mountain Maniacs - Mountain Bike - Red - 26 Inch",2800,"Mountain Maniacs - Mountain Bike - Red - 26 InchBike is in excellent condition. Brand New!!!FRAME	SteelFORK	SteelRIMS	26"" AlloyTIRES	26x2.1PEDALS	NylonCRANK	SteelCHAIN	7 SpeedREAR COGS	7 SpeedFRONT DERAILLEUR	7 SpeedREAR DERAILLEUR	7 SpeedSHIFTERS	7 Speed (14-28T) index shifterHANDLEBAR	SteelBRAKES	V-brakeFollow this link for unbeatable deals on bicycles:http://discountbicycles-sa.comFollow the link below for unbeatable deals on accessories:https://cycle-teknix-online.myshopify.comFree delivery on all bikes nationwide!Mechanical Guarantee: All components will be in a very reasonable to new condition on pre-owned bikes. Full QC check and service undergone prior to delivery.Packaging: All bikes are securely boxed and packaged to avoid any damages in transit.Race Ready: Bikes are delivered “race ready” meaning you simply have to fit the front wheel, seat post and pedals and there you go – Riding!Trading hours: Monday to Friday 08h00 – 18h00 Saturday 08h00 to 14h00 Contact us: Tel: (021) 556 8207 or hanber@cycleteknix.co.za or WhatsApp 084 550 1353Address: 145 Blaauwberg Road, Table View, Cape Town, 7441.Website: View our website for more great specials: www.cycleteknix.co.zaItems Available: 2",4,39,"2021-10-22 12:35:53","Cycle Teknix","Tableview, West Coast, Western Cape",NA,NA,NA,"2021-10-26 12:35:53","Western Cape"
"8","https://www.gumtree.co.za/s-mountain-bikes/v1c9800p1page-1/v1c9800p1",1,"https://www.gumtree.co.za/a-mountain-bikes/kuils-river/29er-small-silverback-sola-3-mtb-+-lockout-air-fork-+-hydraulic-disk-brakes-+-slx-jockey/10010068459101010003575409",8,"29ER SMALL SILVERBACK SOLA 3 MTB - LOCKOUT AIR FORK - HYDRAULIC DISK BRAKES - SLX JOCKEY",8500,"29ER SILVERBACK SOLA 3 MOUNTAINBIKE!!EXCELLENT CONDITION.**SMALL FRAME // 29ER WHEELS****LOCKOUT AIR SHOCK****SLX JOCKEY**SERVICED AND READY TO RACE! SMALL Silverback Sola 3 Alloy Frame MTBSR Suntour RADION AIR FORK with LockoutSBC Double Wall Rims - Tubeless Ready Maxxis TyresSHIMANO HYDRAULIC DISK BRAKESSHIMANO SLX JockeySHIMANO CrankSHIMANO ALIVIO RAPIDFIRE SHIFTERSSHIMANO Alivio Front DerailleurSilverback SBC Handlebar and StemSilverback SBC Seat and SeatpostFlat Pedals**BIKE IS IN AN EXCELLENT CONDITION**GET ON AND GO // RACE READY!!!Price: R8500 NOT NEG!!!For more infoLizelle: 0826038599Items Available: 1",19,49,"2021-10-25 18:35:54","LizelleVDM","Kuils River, Northern Suburbs, Western Cape",NA,NA,NA,"2021-10-26 12:35:54","Western Cape"
"9","https://www.gumtree.co.za/s-mountain-bikes/v1c9800p1page-1/v1c9800p1",1,"https://www.gumtree.co.za/a-mountain-bikes/tokai/american-classic-terrian-27-5-xd-driver/1009554138220911247410409",9,"AMERICAN CLASSIC TERRIAN 27.5 XD DRIVER",4500,"AMERICAN CLASSIC TERRIAN 27.5 XD DRIVERItems Available: 1",1,504,"2021-07-27 05:05:54","Bridge Cycles CC","Tokai, Southern Suburbs, Western Cape",NA,NA,NA,"2021-10-26 12:35:54","Western Cape"
"10","https://www.gumtree.co.za/s-mountain-bikes/v1c9800p1page-1/v1c9800p1",1,"https://www.gumtree.co.za/a-mountain-bikes/chatsworth/mountain-bike/10010071555361012793107809",10,"Mountain bike",1000,"Its 20"" need to sort out breaks and chain",1,0,"2021-10-26 11:57:54","Melanie Govender","Chatsworth, Durban City, KwaZulu-Natal",NA,NA,NA,"2021-10-26 12:35:54","KwaZulu-Natal"
"11","https://www.gumtree.co.za/s-mountain-bikes/v1c9800p1page-1/v1c9800p1",1,"https://www.gumtree.co.za/a-mountain-bikes/constantia/mountain-bike-+-axis-30-+-cape-town+-new-29er-mountain-bike-r14500/1008092087780911247410409",11,"Mountain Bike - Axis 30 - Cape Town- New 29ER Mountain Bike R14500",14500,"Mountain Bike - Axis 30 - Cape Town- New 29ER Mountain Bike R14500Size: LargePrice: R14500 (Save R3000). We Deliver Nationwide! Kindly Contact Us For Details. Call / Email / Whatsapp/Cell: 0832310974 or 021 715 07 32 Monday to Friday 10am-6pm. Fridays 10am-6pm [Closed from 12pm-2pm]Saturday 10am-3pm.Specs:A30 ComponentsDrivetrain	Shimano SLX/Deore 20 Speed (38T/24T chainring & 11/36T cassette)Fork	RockShox XC30 Solo Air with remote lockout (100m travel & 9mm QR)Brakes	Shimano BL-M396 lever & BR-M395 disks (180 front & 160 rear)Wheels	Kore XCD 29erTyres	CST Jack Rabbit 29 x 2.1Bar	Kore XCD 2 Flat Bar 31.0 Ø x 710mmStem	Kore XCD Stem 31.0 ØSeat Post	Kore XCD Seat Post 31.6 Ø x 400mmSaddle	Kore Durox SaddlePedals	Shimano PD-M505 (SPD Pedals)We Deliver Nationwide! Kindly Contact Us For Details. Call / Email / Whatsapp/Cell: 0832310974 or 021 715 07 32 Monday to Friday 10am-6pm. Fridays 10am-6pm [Closed from 12pm-2pm]Saturday 10am-3pm.Items Available: 1",1,3684,"2020-10-26 06:35:55","Bridge Cycles CC","Constantia, Southern Suburbs, Western Cape",NA,NA,NA,"2021-10-26 12:35:55","Western Cape"
"12","https://www.gumtree.co.za/s-mountain-bikes/v1c9800p1page-1/v1c9800p1",1,"https://www.gumtree.co.za/a-mountain-bikes/tableview/mountain-maniacs-+-kids-bicycle-+-blue-+-20-inch/10010056189881011364600209",12,"Mountain Maniacs - Kids Bicycle - Blue - 20 Inch",1600,"Mountain Maniacs - Kids Bicycle - Blue - 20 InchSuitable for kids aged 6 to 10 yearsBikes are in excellent condition. Brand New!!!FRAME	SteelFORK	SteelREAR SHOCK	RIMS	20"" Alloy	CHAIN	Single speedREAR COGS	Single speed	BRAKES	Steel Caliber Single SpeedFollow this link for unbeatable deals on bicycles:http://discountbicycles-sa.comFollow the link below for unbeatable deals on accessories:https://cycle-teknix-online.myshopify.comFree delivery on all bikes nationwide!Mechanical Guarantee: All components will be in a very reasonable to new condition on pre-owned bikes. Full QC check and service undergone prior to delivery.Packaging: All bikes are securely boxed and packaged to avoid any damages in transit.Race Ready: Bikes are delivered “race ready” meaning you simply have to fit the front wheel, seat post and pedals and there you go – Riding!Trading hours: Monday to Friday 08h00 – 18h00 Saturday 08h00 to 14h00 Contact us: Tel: (021) 556 8207 or hanber@cycleteknix.co.za or WhatsApp 084 550 1353Address: 145 Blaauwberg Road, Table View, Cape Town, 7441.Website: View our website for more great specials: www.cycleteknix.co.zaItems Available: 3",3,37,"2021-10-22 12:35:55","Cycle Teknix","Tableview, West Coast, Western Cape",NA,NA,NA,"2021-10-26 12:35:55","Western Cape"
"13","https://www.gumtree.co.za/s-mountain-bikes/v1c9800p1page-1/v1c9800p1",1,"https://www.gumtree.co.za/a-mountain-bikes/claremont-newlands/2021-gt-avalanche-sport-29er/10010071228441012768732409",13,"2021 GT AVALANCHE SPORT 29er",7999,"2x9 Microshift Set Up 
29er 
Medium  Size
 Ridden Once .
A very good deal for a R15k bike
",8,10,"2021-10-26 11:35:55","Save Cyclists","Claremont & Newlands, Southern Suburbs, Western Cape",NA,NA,NA,"2021-10-26 12:35:55","Western Cape"
"14","https://www.gumtree.co.za/s-mountain-bikes/v1c9800p1page-1/v1c9800p1",1,"https://www.gumtree.co.za/a-mountain-bikes/tableview/demo-carbon-hollowgram-mtb-wheelset-+-25mm-id/1009900469060911364600209",14,"***DEMO CARBON HOLLOWGRAM, MTB WHEELSET - 25MM ID***",12500,"WE HAVE A SET OF CARBON HOLLOWGRAM WHEELS THAT WAS USED ONCE OR TWICE.THE WHEELS ARE IN BRILLIANT CONDITION.THE FRONT HUB IS CURRENTLY FOR A CANNONDALE LEFTY BUT THIS CAN BE EXCHANGED FOR FOR A NORMAL THRU AXEL HUB AT A AN ADDITIONAL FEE OF R 1000.00THE REAR HUB IS BOOST.ASKING PRICE: R 12 500.00THIS IS THE BEST SPEC AND QUALITY CARBON MOUNTAIN BIKE WHEELSET YOU WILL FIND AT THIS PRICE. Follow this link for unbeatable deals on bicycles:http://discountbicycles-sa.comFollow the link below for unbeatable deals on accessories:https://cycle-teknix-online.myshopify.comFree delivery on all bikes nationwide!Mechanical Guarantee: All components will be in a very reasonable to new condition on pre-owned bikes. Full QC check and service undergone prior to delivery.Packaging: All bikes are securely boxed and packaged to avoid any damages in transit.Race Ready: Bikes are delivered “race ready” meaning you simply have to fit the front wheel, seat post and pedals and there you go – Riding!Trading hours: Monday to Friday 08h00 – 18h00 Saturday 08h00 to 14h00 Contact us: Tel: (021) 556 8207 or hanber@cycleteknix.co.za or WhatsApp 084 550 1353Address: 145 Blaauwberg Road, Table View, Cape Town, 7441.Website: View our website for more great specials: www.cycleteknix.co.zaItems Available: 1",3,304,"2021-09-26 02:05:56","Cycle Teknix","Tableview, West Coast, Western Cape",NA,NA,NA,"2021-10-26 12:35:56","Western Cape"
"15","https://www.gumtree.co.za/s-mountain-bikes/v1c9800p1page-1/v1c9800p1",1,"https://www.gumtree.co.za/a-mountain-bikes/kuils-river/27-5-small-avalanche-reflex-3-+-disk-brakes-+-double-wall-rims-+-excellent-condition-+-ready-to-race/10010052812871010003575409",15,"27.5 SMALL AVALANCHE REFLEX 3 - DISK BRAKES - DOUBLE WALL RIMS - EXCELLENT CONDITION - READY TO RACE",4500,"27.5INCH / 650B SMALL FRAME AVALANCHE REFLEX 3.0.GREAT CONDITION, VERY WELL LOOKED AFTER. USED LESS THAN 5 TIMES. BIKE HAD A MINOR SERVICE, CHECKED AND READY TO GO.**27.5INCH WHEELS // 16INCH FRAME****DISK BRAKES****DOUBLE WALL RIMS**SMALL 16INCH ALLOY FRAMEZOOM FORKAVALANCHE DOUBLE WALL RIMSSHIMANO MECHANICAL DISK BRAKESAVALANCHE MTB TYRESSHIMANO REAR DERAILLEUR 7 XSHIMANO FRONT DERAILLEURSHIMANO CRANK 3 XSHIMANO RAPIDFIRE SHIFTERS AVALANCHE HANDLEBAR AND STEMAVALANCHE SEAT AND SEAT POST BOTTLE HOLDERPUMP WITH PUMP HOLDERBIKE IS IN A GREAT CONDITION. GOOD PRICE FOR A DECENT ENTRY LEVEL BIKE. RACE READY // GET ON AND GOPRICE: R4500 NOT NEG! FOR MORE INFO LIZELLE: 0826038599 Items Available: 1",17,202,"2021-10-22 12:35:56","LizelleVDM","Kuils River, Northern Suburbs, Western Cape",NA,NA,NA,"2021-10-26 12:35:56","Western Cape"
"16","https://www.gumtree.co.za/s-mountain-bikes/v1c9800p1page-1/v1c9800p1",1,"https://www.gumtree.co.za/a-mountain-bikes/brackenfell/29er-giant-bicycle-for-sale/10010071373901012735703809",16,"29er Giant bicycle for sale",2350,"Giant Cypress 29er bicycle
-21 speed
-vbrakes
-tires are still good
Bike in good riding condition but can do with a minor service and has some stuff marks.
Collection in Brackenfell
",3,4,"2021-10-26 11:35:56","loren martin","Brackenfell, Northern Suburbs, Western Cape",NA,NA,NA,"2021-10-26 12:35:57","Western Cape"
"17","https://www.gumtree.co.za/s-mountain-bikes/v1c9800p1page-1/v1c9800p1",1,"https://www.gumtree.co.za/a-mountain-bikes/tableview/2021-gt-comp-29r-+-limited-stock/1009857087460911364600209",17,"2021 GT Comp 29R - Limited Stock!",16000,"2020 GT Comp - Limited Stock!SIZES	                         M, MD, LG , XLFRAME	                         GT 6061 T6 Aluminum Frame, Triple Triangle w/ Floating Seat Stays, Internal Cable Routing, Dropper Post Routing, Boost 141 Forged Drop-outs w/ Disc Brake Mounts, Zero Stack Tapered 1 1/8""- 1.5"" Head Tube, 27.5/29"" WheelsFORK	                           SR Suntour XCR - 120mm Travel , Remote Lockout, Air ForkCHAIN	                           KMC Z9, 10 speedCRANK	                           Prowheel Charm - 32TBOTTOM BRACKE:          Cartridge, Square TaperPEDALS	                           GT Slim Line Flat PedalFRONT DERAILLEUR	   N/AREAR DERAILLEUR	   Shimano Deore 10 SpeedSHIFTERS	                   Shimano Deore 10 SpeedCOG SET	                   Shimano Deore 10 SpeedRIMS	                           WTB SX19, 32hTIRES	                           WTB Ranger Comp, 27.5/29 x 2.25"", DNA CompoundFRONT HUB	                   Alloy Disc, QRREAR HUB	                   Alloy Disc Cassette QR, 28HSPOKES	                           Stainless Steel, 14gBRAKES	                           Shimano Hydro Disc, 160/160mm RotorFRONT BRAKE	           Shimano Hydro Disc, 160/160mm RotorREAR BRAKE	                   Shimano Hydro Disc, 160/160mm RotorHANDLEBAR	                   GT All Terra Alloy Riser, 25mm Rise, 8° Sweep, 6° Rise, 720mm WidthSTEM	                           GT All Terra, 6061 Alloy, 31.8, 8°GRIPS	                           GT StatementHEADSET	                   Semi-integrated, Sealed CartridgeSADDLE	                           GT MTBSEAT POST	                   GT All Terra Two Bolt AlloyFollow this link for unbeatable deals on bicycles:http://discountbicycles-sa.comFollow the link below for unbeatable deals on accessories:https://cycle-teknix-online.myshopify.comFree delivery on all bikes nationwide!Mechanical Guarantee: All components will be in a very reasonable to new condition on pre-owned bikes. Full QC check and service undergone prior to delivery.Packaging: All bikes are securely boxed and packaged to avoid any damages in transit.Race Ready: Bikes are delivered “race ready” meaning you simply have to fit the front wheel, seat post and pedals and there you go – Riding!Trading hours: Monday to Friday 08h00 – 18h00 Saturday 08h00 to 14h00 Contact us: Tel: (021) 556 8207 or hanber@cycleteknix.co.za or WhatsApp 084 550 1353Address: 145 Blaauwberg Road, Table View, Cape Town, 7441.Website: View our website for more great specials: www.cycleteknix.co.zaItems Available: 1",1,1002,"2021-09-26 02:05:57","Cycle Teknix","Tableview, West Coast, Western Cape",NA,NA,NA,"2021-10-26 12:35:57","Western Cape"
"18","https://www.gumtree.co.za/s-mountain-bikes/v1c9800p1page-1/v1c9800p1",1,"https://www.gumtree.co.za/a-mountain-bikes/goodwood/california-bicycle/10010071203211010354660209",18,"California bicycle",495,"California bicycle is a brand that specially builds low cost quality bikes for third world countries. These bikes are built sturdy, with  parts that are easy to replace and cheap to fix the bikes have 6 speed,fenders,bar ends and sturdy tires etc .hardly used for more information contact or WhatsApp 084 857 8441",4,7,"2021-10-26 11:35:57","Les Cash","Goodwood, Northern Suburbs, Western Cape",NA,NA,NA,"2021-10-26 12:35:57","Western Cape"
"19","https://www.gumtree.co.za/s-mountain-bikes/v1c9800p1page-1/v1c9800p1",1,"https://www.gumtree.co.za/a-mountain-bikes/brackenfell/giant-boulder-26er-for-sale/10010071332481012735703809",19,"Giant Boulder 26er For Sale",2200,"Giant Boulder 26er24 speedsmall frame size26er wheelsbrakesslick tirescomfy seatGood riding  condition!Collection in Brackenfell",4,1,"2021-10-26 11:35:58","loren martin","Brackenfell, Northern Suburbs, Western Cape",NA,NA,NA,"2021-10-26 12:35:58","Western Cape"
"20","https://www.gumtree.co.za/s-mountain-bikes/v1c9800p1page-1/v1c9800p1",1,"https://www.gumtree.co.za/a-mountain-bikes/tableview/mountain-maniacs-+-kids-bicycle-+-red-+-20-inch/10010056525051011364600209",20,"Mountain Maniacs - Kids Bicycle - Red - 20 Inch",1600,"Mountain Maniacs - Kids Bicycle - Red - 20 InchSuitable for ages 6 to 10 yearsBikes are in excellent condition. Brand New!!!!FRAME	SteelFORK	SteelRIMS	20"" Alloy	CHAIN	Single speedREAR COGS	Single speed	BRAKES	Steel Caliber Single SpeedFollow this link for unbeatable deals on bicycles:http://discountbicycles-sa.comFollow the link below for unbeatable deals on accessories:https://cycle-teknix-online.myshopify.comFree delivery on all bikes nationwide!Mechanical Guarantee: All components will be in a very reasonable to new condition on pre-owned bikes. Full QC check and service undergone prior to delivery.Packaging: All bikes are securely boxed and packaged to avoid any damages in transit.Race Ready: Bikes are delivered “race ready” meaning you simply have to fit the front wheel, seat post and pedals and there you go – Riding!Trading hours: Monday to Friday 08h00 – 18h00 Saturday 08h00 to 14h00 Contact us: Tel: (021) 556 8207 or hanber@cycleteknix.co.za or WhatsApp 084 550 1353Address: 145 Blaauwberg Road, Table View, Cape Town, 7441.Website: View our website for more great specials: www.cycleteknix.co.zaItems Available: 1",3,37,"2021-10-22 12:35:58","Cycle Teknix","Tableview, West Coast, Western Cape",NA,NA,NA,"2021-10-26 12:35:58","Western Cape"
"21","https://www.gumtree.co.za/s-mountain-bikes/v1c9800p1page-1/v1c9800p1",1,"https://www.gumtree.co.za/a-mountain-bikes/kuils-river/cash-for-your-mountainbike/1007707981430910003575409",21,"CASH FOR YOUR MOUNTAINBIKE",17500,"I PAY CASH FOR YOUR UNWANTED MOUNTAINBIKE !ANYWHERE IN THE WESTERN CAPE. I WILL COME TO YOU !No need to advertise and have countless people wasting your time with silly offers!!!NO SCAMMING OR TIME WASTING! CASH FOR YOUR MTB!SELL YOUR MOUNTAINBIKE OR DO A TRADE IN? ANY WHEEL SIZE, 26ER, 27.5"" OR 29ERS !!ANY FRAME SIZE !!MUST HAVE DISK BRAKES !!NO GAME OR MAKRO BRANDS !!BEST PRICES OFFERED 24/7SEND ME A SMS/WHATSAPP/EMAIL OR GIVE ME A CALL IF YOU WANT TO SELL OR DO A TRADE IN !!0826038599Tags: giant merida mtb mountainbike bicycle cycle specialized cannondale scott bianchi titan duel suspension hardtail softtail trek silverback momsen shimano sram deore gt zaskar karakoram mongoose carbon alloy bmc northern southern suburbs cape town century city strand gordons bay somerset west stellenbosch paarl milnertonTo Connect on Whatsapp, please click:https://api.whatsapp.com/send?phone=27826038599Items Available: 1",1,4175,"2020-10-26 06:35:58","LizelleVDM","Kuils River, Northern Suburbs, Western Cape",NA,NA,NA,"2021-10-26 12:35:58","Western Cape"
"22","https://www.gumtree.co.za/s-mountain-bikes/v1c9800p1page-1/v1c9800p1",1,"https://www.gumtree.co.za/a-mountain-bikes/kuils-river/cash-for-your-bicycle/1007416741880910003575409",22,"CASH FOR YOUR BICYCLE",17500,"PAY CASH FOR YOUR UNWANTED MOUNTAINBIKE !ANYWHERE IN THE WESTERN CAPE. I WILL COME TO YOU !No need to advertise and have countless people wasting your time with silly offers!!!NO SCAMMING OR TIME WASTING! CASH FOR YOUR MTB!SELL YOUR MOUNTAINBIKE OR DO A TRADE IN? ANY WHEEL SIZE, 26ER, 27.5"" OR 29ERS !!ANY FRAME SIZE !!MUST HAVE DISK BRAKES !!NO GAME OR MAKRO BRANDS !!BEST PRICES OFFERED 24/7SEND ME A SMS/WHATSAPP/EMAIL OR GIVE ME A CALL IF YOU WANT TO SELL OR DO A TRADE IN !!0826038599Tags: giant merida mtb mountainbike bicycle cycle specialized cannondale scott bianchi titan duel suspension hardtail softtail trek silverback momsen shimano sram deore gt zaskar karakoram mongoose carbon alloy bmc northern southern suburbs cape town century city strand gordons bay somerset west stellenbosch paarl milnertonItems Available: 1",1,4170,"2020-10-26 06:35:59","LizelleVDM","Kuils River, Northern Suburbs, Western Cape",NA,NA,NA,"2021-10-26 12:35:59","Western Cape"
"23","https://www.gumtree.co.za/s-mountain-bikes/v1c9800p1page-1/v1c9800p1",1,"https://www.gumtree.co.za/a-mountain-bikes/muizenberg/scott-scale-elite-29er/10010070615991011005542409",23,"Scott Scale Elite 29er",7900,"-Very Good Condition
-Size Medium Frame
-Hydrotubing Aluminium
-Rockshox Recon Air
-Remote Lockout
-Elixar Hydraulic Brakes
-Shimano SLX 3x10
-American Classic Rims
-American Classic Hubs
-Maxxis Tubeless Tyres

R7900 Negotiable

0718682829",4,26,"2021-10-26 11:35:59","Rifat Adams","Muizenberg, Southern Peninsula, Western Cape",NA,NA,NA,"2021-10-26 12:35:59","Western Cape"
